{
  "disclaimer": "Authorized, read-only assessment of HTTP response headers. This report does not guarantee that the target is secure.",
  "elapsed_ms": 12.5,
  "error": null,
  "final_url": "https://example.com/",
  "findings": [
    {
      "evidence": {
        "header_name": "Strict-Transport-Security",
        "observed": "absent"
      },
      "explanation": "The HTTPS response did not include HSTS.",
      "id": "HEADER-HSTS",
      "reference": "https://datatracker.ietf.org/doc/html/rfc6797",
      "remediation": "Send Strict-Transport-Security with an appropriate max-age on HTTPS responses.",
      "severity": "medium",
      "status": "fail",
      "title": "Strict-Transport-Security header is missing"
    },
    {
      "evidence": {
        "header_name": "Content-Security-Policy",
        "observed": "absent"
      },
      "explanation": "The response did not include a Content-Security-Policy header.",
      "id": "HEADER-CSP",
      "reference": "https://cheatsheetseries.owasp.org/cheatsheets/HTTP_Headers_Cheat_Sheet.html",
      "remediation": "Define a CSP appropriate for the application.",
      "severity": "medium",
      "status": "fail",
      "title": "Content-Security-Policy header is missing"
    },
    {
      "evidence": {
        "header_name": "X-Content-Type-Options",
        "observed": "absent"
      },
      "explanation": "Missing X-Content-Type-Options may allow MIME sniffing.",
      "id": "HEADER-XCTO",
      "reference": "https://cheatsheetseries.owasp.org/cheatsheets/HTTP_Headers_Cheat_Sheet.html",
      "remediation": "Set X-Content-Type-Options: nosniff on applicable responses.",
      "severity": "medium",
      "status": "fail",
      "title": "X-Content-Type-Options header is missing"
    },
    {
      "evidence": {
        "header_name": "X-Frame-Options",
        "observed": "absent"
      },
      "explanation": "No X-Frame-Options or CSP frame-ancestors evaluation is performed beyond X-Frame-Options presence here.",
      "id": "HEADER-XFO",
      "reference": "https://cheatsheetseries.owasp.org/cheatsheets/HTTP_Headers_Cheat_Sheet.html",
      "remediation": "Use X-Frame-Options or CSP frame-ancestors to reduce clickjacking risk.",
      "severity": "medium",
      "status": "fail",
      "title": "X-Frame-Options header is missing"
    },
    {
      "evidence": {
        "header_name": "Referrer-Policy",
        "header_value_excerpt": "no-referrer",
        "observed": "present"
      },
      "explanation": "Referrer-Policy is present.",
      "id": "HEADER-RP",
      "reference": "https://owasp.org/www-project-secure-headers/",
      "remediation": "No change required for basic presence review.",
      "severity": "info",
      "status": "pass",
      "title": "Referrer-Policy header is present"
    }
  ],
  "http_status": 404,
  "limitations": [
    "Follows HTTP redirects by default (additional GET per hop); use --no-redirects for one request. No crawling beyond the redirect chain.",
    "Only five selected response headers are evaluated for presence.",
    "Absence or presence of a header is not a complete security assessment.",
    "Does not inspect HTML, cookies, JavaScript, or server-side logic.",
    "Use only on systems you own or are explicitly authorized to test."
  ],
  "redirects": [],
  "report_schema_version": "1.0.0",
  "scan_status": "completed",
  "scanned_at": "2026-09-19T12:00:00Z",
  "summary": {
    "counts": {
      "error": 0,
      "fail": 4,
      "info": 0,
      "pass": 1,
      "warning": 0
    },
    "status": "failed"
  },
  "target_url": "https://example.com/",
  "tool_name": "sentinelpy",
  "tool_version": "1.3.0"
}
